article_id,title,link,author,publication_date,source,summary,keywords,sentiment_score,sentiment_percentage,sentiment_analysis,topics,people,organizations,locations,products,events,business,funding_rounds,investors,financial_metrics,sectors,sub_sectors,innovations,trends,market_gaps,competitor_analysis,customer_insights,relevance_score,severity_score
e7ebec872472c04490bd6c41047d0c4e,"Elon Musk’s xAI releases its latest flagship model, Grok 3",https://techcrunch.com/2025/02/17/elon-musks-ai-company-xai-releases-its-latest-flagship-ai-grok-3/,None,2025-02-17,Techcrunch,"xAI has released its latest AI model, Grok 3, which powers features on X and boasts improved capabilities, including image analysis and reasoning. The company claims Grok 3 beats GPT-4o on benchmarks and will be available via API and with a voice mode in the Grok app.","Grok 3, xAI, AI Model",0.7,70.0,Positive,"Artificial Intelligence, Machine Learning",Elon Musk,"xAI, OpenAI, Google, DeepSeek","Memphis, USA","Grok 3, GPT-4o, Gemini, Grok 3 mini, DeepSearch",None,B2C,None,None,0.0,Generative AI,AI Chatbots,AI-powered research tool DeepSearch Reasoning models with fact-checking,"AI-powered research, Maximally truth-seeking AI, Reasoning models","Need for politically neutral AI, Demand for AI models that provide truthful even controversial answers, Demand for AI models focused on reasoning and fact-checking",Grok 3 competes with OpenAI's GPT-4o and Google's Gemini; Grok 3 Reasoning surpasses o3-mini,"Subscribers to X's Premium+ tier will get access to Grok 3 first; Users can ask Grok 3 to ""Think"" or leverage ""Big Brain"" mode for reasoning",10.0,8.0
e717107c30c875b7279d401f41c75f8d,"Move over, Apple: Meet the alternative app stores coming to the EU",https://techcrunch.com/2025/03/13/move-over-apple-meet-the-alternative-app-stores-coming-to-the-eu/,None,2025-03-13,Techcrunch,"The Digital Markets Act (DMA) allows European Union residents to access alternative app stores, fostering increased competition in the app ecosystem, where stores have their own review processes and are responsible for support and refunds. Several alternative app stores have emerged, including AltStore PAL, Setapp Mobile, Epic Games store, Aptoide, Mobivention, and Skich.","Digital Markets Act, Alternative App Stores, EU",0.3,60.0,Positive,"Mobile Apps, Digital Markets, EU Regulations",Riley Testut,"Apple, AltStore PAL, MacPaw, Setapp, Epic Games, Aptoide, Mobivention, Skich","Lisbon, Portugal","Delta, Clip, UTM, OldOS, Kotoba, iTorrent, qBitControl, PeopleDrop, Setapp Mobile, Fortnite, Rocket League Sideswipe, Fall Guys",Game Developers Conference,B2C,None,None,0.5,Retail Tech,Mobile App Stores,Open source app store subscription based curated apps tinder-like app discovery.,"Alternative App Marketplaces, DMA Compliance, App Store Competition",Lack of alternatives to established app stores high commission fees for developers need for curated app experiences.,"Epic's launch comes after Apple removed Fortnite from its App Store over policy violations, preceding Epic’s legal challenge to the alleged App Store monopoly.",Users seek alternatives to the Apple App Store due to policy concerns and desire for diverse app options developers want lower fees and more control.,8.0,7.0
47b258c1b4a0c6c4f65619f55a10a9c8,Facebook now lets creators get paid for views on stories,https://techcrunch.com/2025/03/13/facebook-now-lets-creators-get-paid-for-views-on-stories/,None,2025-03-13,Techcrunch,"Facebook is rolling out a new monetization option allowing creators to earn money for views on public stories, available globally to those in the Facebook Content Monetization program, providing an additional revenue stream and incentivizing content creation on the platform.","Facebook, Content Monetization, Creator Revenue",0.6,70.0,Positive,"Social Media, Content Creation, Monetization",None,"Facebook, Meta, TikTok",None,"Facebook Stories, Facebook Content Monetization program, In-stream ads, Ads on Reels, Performance Bonus programs",None,B2C,None,None,2000.0,AI in Marketing,"Social Media Marketing, Content Creator Tools",Monetization of ephemeral contentDirect creator payouts based on story views,"Creator economy, Content monetization, Platform competition",Lack of direct monetization options for short-form contenton social media platformsLimited revenue streams for creators besides ads and sponsorships,Meta is luring TikTok creators over to Facebook and Instagram with cash bonuses and content deals.,Creators need more revenue streams beyond traditional ads and sponsorships,8.0,6.0
2f8b46a5b3c4d7e0f9a2c1b3d6e7f8a9,Google wants Gemini to get to know you better,https://techcrunch.com/2025/03/13/google-wants-gemini-to-get-to-know-you-better/,None,2025-03-13,Techcrunch,"Google is introducing Gemini with personalization, an experimental capability for its Gemini chatbot apps that leverages user data from other Google apps to deliver customized responses. The new feature aims to differentiate Gemini in the AI chatbot market by providing tailored assistance based on individual user habits and preferences.","Gemini, Personalization, Google Search",0.3,60.0,Positive,"Artificial Intelligence, Chatbots, Personalization",Dave Citron,"Google, OpenAI, Amazon",None,"Gemini, ChatGPT, Alexa, Gemini 2.0 Flash Thinking Experimental, Google Search, Google Photos, YouTube, Google Calendar, Notes, Tasks, Deep Research, Gems",None,B2C,None,None,20.0,Generative AI,AI Chatbots,Personalized AI assistance based on user data Integration of Gemini with Google services Experimental reasoning model for data relevance Customizable chatbots within Gemini,"AI Personalization, Context-Aware AI, Agentic AI, Customizable AI chatbots",Demand for privacy-conscious AI tools Potential for misuse of personal data in AI responses Need for transparent AI data usage practices,Google competes with OpenAI and Amazon in the AI chatbot market.,Early testers found Gemini with personalization helpful for brainstorming and personalized recommendations. There are privacy concerns over potential misuse of personal data.,9.0,7.0
c0971a80b35640e9831e6a2a9a7f669c,Google introduces new developer tools and titles for games on mobile and PC,https://techcrunch.com/2025/03/13/google-introduces-new-developer-tools-and-titles-for-games-on-mobile-and-pc/,None,2025-03-13,Techcrunch,"Google is launching new developer tools and game titles for both mobile and PC platforms, including a dedicated SDK for native PC games and the ability to distribute mobile games on PC through the Play Store. The company is also introducing a new Graphics API called Vilkan, improving the Android Dynamic Performance Framework, and providing custom controls for games on PC.","Google Play Games, Game Development, Mobile Gaming",0.6,70.0,Positive,"Gaming, Software Development, Mobile Technology",None,"Google, AMD",None,"Google Play Games, Vilkan, Android Dynamic Performance Framework, Google Play Store",Game Developers Conference (GDC),B2C,None,None,0.0,Gaming,"Mobile Gaming, PC Gaming","Mobile games porting to PC, Dedicated SDK for PC games, Graphics API for smoother visuals","Cross-platform gaming, Mobile game optimization, PC gaming accessibility","Improved frame rates for cross-platform games, User acquisition tools for PC games",None,"Players desire custom controls and optimized visuals, Mobile game developers seek easy porting solutions",9.0,7.0
2334b25272364a81b8b317deff31f839,These Google Photos alternatives offer tons of storage options at a reasonable price,https://techcrunch.com/2025/02/15/these-google-photos-alternatives-offer-tons-of-storage-options-at-a-reasonable-price/,None,2025-02-15,Techcrunch,"The article discusses several alternatives to Google Photos, highlighting their storage options and pricing. It mentions services like Flickr, Dropbox, Ente, Cryptee, Amazon Photos, 500px, and Photobucket, comparing their free and paid plans.","Google Photos, Cloud Storage, Photo Storage",0.5,70.0,Positive,"Cloud Storage, Photography, Software",None,"Google, Flickr, Dropbox, Ente, Cryptee, Amazon, Photobucket",None,"Google Photos, Google Drive, Gmail, Flickr, Dropbox, Ente, Cryptee, Amazon Photos, 500px, Photobucket",None,B2C,None,None,0.0,Retail Tech,Digital Asset Management,End-to-end encrypted photo storage Open-source self-hosted photo storage Community-focused photo sharing,Cloud Storage Privacy-focused services Community photo platforms,Lack of privacy in mainstream photo storage Limited free storage tiers Need for community features for photographers,"Flickr, Dropbox, Ente, Cryptee, Amazon Photos, 500px, and Photobucket are presented as alternatives to Google Photos","Users seek alternatives to Google Photos due to limited free storage, privacy concerns, and desire for community features.",7.0,6.0
3a379e1c6e39f3171c4df1378a91b4e9,"Uber sues DoorDash, alleging anti-competitive tactics",https://techcrunch.com/2025/02/14/uber-sues-doordash-alleging-anti-competitive-tactics/,None,2025-02-14,Techcrunch,"Uber has filed a lawsuit against DoorDash, alleging that DoorDash is using anti-competitive tactics to stifle competition by intimidating restaurant owners into exclusive deals. Uber claims DoorDash pressures restaurants to exclusively use DoorDash for first-party delivery services, threatening penalties or demotion on the app.","Uber, DoorDash, Anti-competitive practices",-0.4,55.0,Negative,"Legal, Food Delivery, Business",Sarfraz Maredia,"Uber, DoorDash","California, USA","Uber Direct, DoorDash Drive On-Demand, Uber Eats, DoorDash",None,B2B,None,None,0.0,Supply Chain & Logistics,Food Delivery Logistics,White-label delivery services First-party delivery management,Exclusive partnerships Gig economy growth,Need for fair competition Lack of alternative delivery options Need for transparent pricing,Uber competes with DoorDash in food delivery services and white-label delivery services.,"Restaurants are reportedly feeling pressured and bullied by DoorDash's tactics, limiting their freedom to choose delivery partners and impacting their business growth.",8.0,7.0
62555447726242986312085222704728243907,Mastodon is working to add the controversial ‘quote posts’ feature,https://techcrunch.com/2025/02/14/mastodon-is-working-to-add-the-controversial-quote-posts-feature/,None,2025-02-14,Techcrunch,"Mastodon is developing a quote post feature, similar to Twitter's, with added user controls to mitigate potential online abuse and bullying, a feature that has divided its user base. The platform is collaborating to standardize the implementation across all Mastodon apps, aiming for release after addressing technical challenges and user concerns.","Mastodon, Quote Posts, Social Media",-0.2,60.0,Negative,"Social Media, Software Development, Privacy",None,"Mastodon, Twitter, X, Threads, Bluesky",None,None,None,B2C,None,None,0.0,Social Media,Decentralized Social Networks,User-controlled quotability Post withdrawal from quoted context Standardized quote post specification,Decentralized social media User control features Platform standardization Cross-platform functionality,Mitigating online abuse in decentralized social networks Standardized features across federated apps User control over content reframing,"Mastodon aims to compete with X, Threads, and Bluesky by incorporating features while addressing abuse concerns.","Users are divided over quote posts, with concerns about abuse balanced by desire for referencing features.",8.0,6.0
e86d40c36167236c562a8151f774f325,Instagram tests a ‘dislike’ button for comments,https://techcrunch.com/2025/02/14/instagram-tests-a-dislike-button-for-comments/,None,2025-02-14,Techcrunch,"Instagram is testing a dislike button for comments on Feed posts and Reels, allowing users to privately signal negative sentiment or irrelevance without a public dislike count; the feature may eventually influence comment ranking.","Instagram, Dislike Button, Comment Ranking",0.2,60.0,Positive,"Social Media, Product Development, User Experience","Adam Mosseri, Alessandro Paluzzi","Instagram, Meta, Reddit",None,"Instagram Feed, Instagram Reels",None,B2C,None,None,0.0,AI in Marketing,Social Media Analytics,Private dislike signalingcomment ranking influence,User feedback integrationcomment quality control,Lack of nuanced comment moderation toolsneed for better comment relevance filtering,Meta is moving in a similar direction of Reddit's upvotes and downvotes mechanism.,Users seek better control over their Instagram experience and comment section quality.,8.0,5.0
4d9a8f0a5e6b3c1a7b2f8e4c6d3a2b1,OpenAI removes certain content warnings from ChatGPT,https://techcrunch.com/2025/02/13/openai-removes-certain-content-warnings-from-chatgpt/,None,2025-02-13,Techcrunch,"OpenAI has removed warning messages in ChatGPT related to potential terms of service violations, aiming to reduce unnecessary denials, though content policies still apply.","ChatGPT, OpenAI, Content Moderation",0.2,60.0,Positive,"Artificial Intelligence, Chatbots, Content Policy","Laurentia Romaniuk, Nick Turley, Donald Trump, Elon Musk, David Sacks","OpenAI, Reddit",None,ChatGPT,None,B2C,None,None,0.0,Generative AI,AI Chatbots,Adaptive content moderation Contextual AI response generation,AI Personalization Content Moderation,Lack of customizable AI content moderation tools Unmet demand for unbiased AI response generation Difficulty of viewpoint-neutral AI,David Sacks singled out OpenAI’s ChatGPT as programmed to be woke,Users perceive ChatGPT as censored or unreasonably filtered Users want to 'use ChatGPT as [they] see fit',9.0,7.0
12345abc,Telegram releases improved sticker search and video consumption features,https://techcrunch.com/2025/02/13/telegram-releases-improved-sticker-search-and-video-consumption-features/,None,2025-02-13,Techcrunch,"Telegram has released new updates to its app, including improved sticker search using AI and enhanced video consumption features like time-stamped sharing and custom cover photos. The platform is also adding support for saved video progress and suggesting similar bots to users.","Telegram, AI sticker search, Video consumption",0.6,70.0,Positive,"Social Media, Artificial Intelligence",None,"Telegram, YouTube",None,"Telegram, Telegram AI-powered sticker search",None,B2C,None,None,0.0,Generative AI,"AI-powered search, Chatbots",AI-powered sticker search Natural language sticker retrieval Suggesting similar bots Personalized video thumbnails,AI-powered features Personalized content discovery,Lack of comprehensive tools for content moderation on Telegram Limited video discovery options beyond channel suggestions,Telegram's video sharing feature competes with YouTube's timestamp feature,Users are looking for more efficient ways to discover content and express themselves through stickers and videos,8.0,5.0
d41d8cd98f00b204e9800998ecf8427e,Elon Musk’s X will pay Trump $10M to settle lawsuit over 2021 ban,https://techcrunch.com/2025/02/12/elon-musks-x-will-pay-trump-10m-to-settle-lawsuit-over-2021-ban/,None,2025-02-12,Techcrunch,X (formerly Twitter) will pay Donald Trump $10 million to settle a lawsuit related to his ban following the January 6th Capitol riot. The settlement proceeds despite Trump's increasingly close relationship with Elon Musk.,"Elon Musk, Donald Trump, X (Twitter)",0.1,20.0,Neutral,"Social Media, Legal, Politics","Elon Musk, Donald Trump, Jack Dorsey","X, Twitter, Meta","Washington, USA",None,None,None,None,None,10.0,Legal Tech,Litigation,None,Political influence on social media platforms,None,Meta agreed to pay $25 million to settle a related lawsuit.,None,6.0,7.0
27b408c32a300576125093903a9068e0,Reddit hints at expanded AI-powered search,https://techcrunch.com/2025/02/12/reddit-hints-at-expanded-ai-powered-search/,None,2025-02-12,Techcrunch,"Reddit plans to launch an upgraded AI-powered search experience in 2025 by integrating Reddit Answers into its existing search, aiming to help users navigate the platform and answer complex questions. The company is also expanding AI-powered features like translation and insights for brands.","AI-powered Search, Reddit Answers, AI Translation",0.3,65.0,Positive,"Artificial Intelligence, Social Media, Search Technology","Steve Huffman, Drew Vollero","Reddit, Google",None,"Reddit Answers, AI-powered search",None,B2C,None,None,0.0,Generative AI,AI-Powered Search,AI-driven content summarization RedditAnswers integration onboarding search capabilities,AI-powered search AI-driven content summarization,Improved social media search Subjective question answering AI onboarding,"Reddit's Q4 results were impacted by changes to Google's search algorithm, indicating a competitive dynamic in search traffic.","Users need better navigation and answers to complex questions on Reddit, highlighting the demand for improved search and content summarization capabilities.",9.0,7.0
a1b2c3d4e5f6g7h8i9j0,"Sesame, the startup behind the viral virtual assistant Maya, releases its base AI model",https://techcrunch.com/2025/03/13/sesame-the-startup-behind-the-viral-virtual-assistant-maya-releases-its-base-ai-model/,None,2025-03-13,Techcrunch,"Sesame, an AI company, has released CSM-1B, the base AI model that powers Maya, its impressively realistic voice assistant; the model is a 1 billion parameter model under an Apache 2.0 license, allowing commercial use.","Voice Cloning, AI Model, Virtual Assistant",0.2,60.0,Positive,"Generative AI, Voice Technology",Brendan Iribe,"Sesame, Google, Meta, OpenAI, Andreessen Horowitz, Spark Capital, Matrix Partners, Hugging Face, GitHub, Oculus, Consumer Reports",None,"Maya, CSM-1B, SoundStream, Encodec, Llama, Voice Mode",None,B2B,None,"Andreessen Horowitz, Spark Capital, Matrix Partners",0.0,Generative AI,"Voice AI, Audio Generation",Realistic voice assistant base model RVQ audio codes,Voice cloning AI assistants Open-source AI models,Safeguards against misuse of voice cloning technology Ethical guidelines for AI model development Transparency in AI training data,"Sesame's assistant tech resembles OpenAI's Voice Mode, Consumer Reports warns that many AI-powered voice cloning tools lack safeguards","Developers are seeking commercially usable AI models, users desire realistic voice cloning capabilities, there are growing concerns about the ethical implications and potential misuse of voice cloning technology",9.0,7.0
c6b5f2a3d4e769b15a82cd98c3339321,Y Combinator’s police surveillance darling Flock Safety raises $275M at $7.5B valuation,https://techcrunch.com/2025/03/13/y-combinators-police-surveillance-darling-flock-safety-raises-275m-at-7-5b-valuation/,None,2025-03-13,Techcrunch,"Flock Safety, a company that provides computer vision-enabled video surveillance technology to law enforcement and businesses, has raised $275 million at a $7.5 billion valuation; the company's revenue growth and public safety products have attracted significant investment.","Flock Safety, Surveillance Technology, License Plate Recognition",0.3,60.0,Positive,"Venture Capital, Public Safety, Surveillance","Garrett Langley, Geoff Lewis, Holly Beilin, David Ulevitch, Garry Tan","Flock Safety, Y Combinator, Bedrock Capital, ACLU, Aerodome, PitchBook, Andreessen Horowitz, Greenoaks, Meritech Capital, Matrix Partners, OpenAI, Rippling, Mach Industries, Founders Fund","Atlanta, USA","Automatic License Plate Recognition, Gunshot Detection Tech, Public Safety Drones",Series A Funding,B2B,Series A,"Sequoia Capital, a16z, Andreessen Horowitz, Greenoaks, Meritech Capital, Matrix Partners, Y Combinator",275.0,Cybersecurity,Surveillance Tech,Computer vision enabled surveillance technology gunshot detection tech public safety drones,"Video surveillance, Computer vision, Public safety technology",Lack of independent review for surveillance products privacy concerns in mass surveillance,None,Concerns over mass surveillance and privacy violations lawsuits over data usage,7.0,6.0
e98c9b5d8e878e31792b6a7f0a3e8691,Minimalist Light Phone III launches March 27,https://techcrunch.com/2025/03/13/minimalist-light-phone-iii-launches-march-27/,None,2025-03-13,Techcrunch,"Light is launching the Light Phone III on March 27, a minimalist phone designed to help consumers disconnect from smartphone distractions, featuring an AMOLED display, camera, NFC, and improved repairability.","Light Phone III, Minimalist Phone, Disconnection",0.5,75.0,Positive,"Consumer Tech, Mobile Devices",Joe Hollier,Light,None,Light Phone III,None,B2C,None,None,0.0,Retail Tech,Consumer Electronics,Improved repairability minimalist design,Digital Detox Minimalism Focus on mental health,Demand for less-distracting devices privacy concerns sustainable electronics,None,Consumers seek alternatives to distracting smartphones desire for privacy and mental well-being,8.0,6.0
a1b2c3d4e5f6g7h8i9j0k1l2m3n4o5p6,10 startups to watch from Y Combinator’s W25 Demo Day,https://techcrunch.com/2025/03/13/10-startups-to-watch-from-y-combinators-w25-demo-day/,None,2025-03-13,Techcrunch,"Y Combinator's Winter 2025 Demo Day showcased 160 startups, with a focus on AI agent enhancement tools rather than building their own AI agents, highlighting support tools for other companies' AI development. The selected startups include solutions ranging from AI agent teleoperation to automating restaurant management and vintage clothing curation.","Y Combinator, AI Agents, Startup",0.7,70.0,Positive,"Venture Capital, Artificial Intelligence, Startups",Eva Herget,"Y Combinator, Stripe, Airbnb, Reddit, OpenAI, Waymo, Cornell, Goldman Sachs, Apple, Burger King, Shield AI, Saronic","San Francisco, USA","Operator, The Field Hand",Y Combinator Winter 2025 Demo Day,B2B,None,None,5.0,Generative AI,AI Agent Tools,API for agent teleoperation AI agents for browser navigation AI grading automation AI powered vibe coding AI clone for zoom calls AI agents for restaurant management weeding robot vintage clothing marketplace autonomous patrol boats,Generative AI AI Agents AI-assisted Coding Autonomous Systems,Need for better tools to manage AI agents improving grading efficiency in universities efficient restaurant inventory management creating safer sea borders,Anthropic competes with OpenAI,Remote teams want better Zoom meeting presence Restaurants need better inventory management control,9.0,7.0
f7c9a41674737a7b67e8f1a739a49b1c,TechCrunch All Stage unveils a powerhouse agenda for founders,https://techcrunch.com/2025/03/13/techcrunch-all-stage-unveils-a-powerhouse-agenda-for-founders/,None,2025-03-13,Techcrunch,"TechCrunch All Stage, formerly Early Stage, is returning to Boston on July 15 with an agenda focused on helping founders scale their companies from Pre-Seed through Series C. The event will feature leading investors and entrepreneurs who will provide advice and answer questions on founder-focused topics.","Founders, Series A, VCs",0.7,70.0,Positive,"Venture Capital, Startups, Events","Charles Hudson, Chris Gardner, Jahanvi Sardana, Tiffany Luck, Jon McNeill, Cathy Cao","Precursor Ventures, Underscore.vc, Index Ventures, NEA, DVx Ventures, Sapphire Ventures, TechCrunch","Boston, USA",None,"TC All Stage, TC Sessions: AI",B2B,"Pre-Seed, Series A, Series C","Sequoia Capital, a16z, Precursor Ventures, Underscore.vc, Index Ventures, NEA, DVx Ventures, Sapphire Ventures",0.0,Venture Capital,None,Networking platform Braindate,"Founder-focused events, Investor-founder networking, Scaling startups",None,None,"Founders seek advice on scaling from Pre-Seed through Series C, need help on how to raise for Series C and beyond",7.0,5.0
454e0914f8f98959cc64b310f22a6697,5 ways TechCrunch Sessions: AI will fuel your AI growth,https://techcrunch.com/2025/03/13/5-ways-techcrunch-sessions-ai-will-fuel-your-ai-growth/,None,2025-03-13,Techcrunch,"TechCrunch Sessions: AI is an upcoming event on June 5th at UC Berkeley, bringing together AI experts, investors, and enthusiasts to exchange ideas and explore AI innovations, also showcasing AI breakthroughs and technologies.","TechCrunch Sessions: AI, AI event, AI innovation",0.8,80.0,Positive,"Artificial Intelligence, Events, Technology","Jae Lee, Oliver Cameron, Kanu Gulati","Twelve Labs, Odyssey, Khosla Ventures, UC Berkeley, TechCrunch","Berkeley, USA",None,"TC Sessions: AI, Sessions: AI Week",None,None,Khosla Ventures,0.21,Generative AI,None,Networking events Workshops AI breakthroughs,AI events AI networking,None,None,AI professionals are eager to explore the world of AI for personal and company growth.,9.0,6.0
