article_id,title,link,author,publication_date,source,summary,keywords,sentiment_score,sentiment_percentage,sentiment_analysis,topics,people,organizations,locations,products,events,business,funding_rounds,investors,financial_metrics,sectors,sub_sectors,innovations,trends,market_gaps,competitor_analysis,customer_insights,relevance_score,severity_score
8b960a77919438f115898104bc1a1b3e,"TikTok sunsets its creator marketplace for TikTok One, a broader solution with AI tools",https://techcrunch.com/2025/02/27/tiktok-sunsets-its-creator-marketplace-for-tiktok-one-a-broader-solution-with-ai-tools/,None,2025-02-27,Techcrunch,"TikTok is shutting down its Creator Marketplace to transition users to TikTok One, a broader platform integrated with AI tools to assist in ad creation and campaign management; the new platform includes the AI-powered Symphony Creative Studio to help marketers generate ads and optimize them with AI suggestions.","TikTok One, AI-powered Ads, Symphony Creative Studio",0.2,60.0,Positive,"Social Media, AI, Advertising",None,TikTok,None,"TikTok One, Symphony Creative Studio, Symphony Assistant, Video Generator, Script Generator",None,B2B,None,None,0.0,AI in Marketing,"Social Media Advertising, AI-Powered Content Creation",AI-powered creative tools digital avatars automated ad generation localized video creation,AI-powered content creation AI-driven marketing personalized advertising AI assistants,Demand for AI tools that generate native looking TikTok content need for streamlined ad campaign management across platforms demand for efficient AI-powered video localization tools,None,Advertisers seek streamlined AI-driven solutions for content creation and ad optimization businesses need tools to quickly adapt marketing campaigns across different languages and regions marketers want AI assistance to generate engaging and native-looking TikTok content,9.0,7.0
80a9313d5c02b0447297b0d82b5892c2,Figure will start ‘alpha testing’ its humanoid robot in the home in 2025,https://techcrunch.com/2025/02/27/figure-will-start-alpha-testing-its-humanoid-robot-in-the-home-in-2025/,None,2025-02-27,Techcrunch,"Figure plans to begin alpha testing its Figure 02 humanoid robot in home settings in 2025, leveraging its ""generalist"" Vision-Language-Action (VLA) model called Helix to accelerate task learning. The company had previously partnered with OpenAI but is now using its own AI models.","Humanoid Robot, Alpha Testing, VLA Model",0.6,70.0,Positive,"Robotics, Artificial Intelligence, Automation",Brett Adcock,"Figure, OpenAI, BMW, Apptronik, Tesla, 1X","Bay Area, USA","Figure 02, Helix, Vision-Language-Action (VLA) model",None,B2B,None,None,0.0,Robotics & Automation,Humanoid Robotics,Generalist Vision-Language-Action model Househould task automation AI orchestration for multiple robots,Humanoid Robots AI-Driven Automation Aging-in-Place Solutions,Affordable home robotics solutions Reliable robot navigation in unstructured environments Personalized robot assistance for elderly,"Figure competes with Apptronik, Tesla, and 1X in the humanoid robotics space; Figure replaced OpenAI's partnership for proprietary AI models.","Automakers want to test robotics in structured environments before homes; Robots could help aging populations live independently; Homes need consistent performance despite messes, uneven lighting, and pets.",9.0,7.0
5c3a7ea9,Microsoft Copilot gets a macOS app,https://techcrunch.com/2025/02/27/microsoft-copilot-gets-a-macos-app/,None,2025-02-27,Techcrunch,"Microsoft has released a macOS app for Copilot, its generative AI chatbot, providing Mac users with a dedicated experience similar to other AI chatbots like ChatGPT. The Copilot app allows users to ask questions, receive AI-generated responses, and utilize features like drafting emails, summarizing documents, and image generation.","Microsoft Copilot, macOS app, Generative AI",0.6,75.0,Positive,"Artificial Intelligence, Software, Applications",None,"Microsoft, OpenAI, Apple",None,"Copilot, ChatGPT, DALL-E 3, Teams, Outlook, Apple Intelligence",None,B2C,None,None,0.0,Generative AI,AI Chatbots,macOS integration for Copilot Voice feature Think Deeper feature using OpenAI’s o1 model unlimited access to AI chatbot features,AI Chatbots AI Assistants Cross-Platform Availability,Dedicated AI apps on macOS for older Mac models Limited voice feature language support More complex task handling in free AI chatbots,Copilot competes with OpenAI’s ChatGPT and Apple Intelligence.,"Mac users seek dedicated AI assistant experiences similar to those available on other platforms; Users value Copilot’s features for tasks like drafting emails, summarizing documents, and image generation.",9.0,7.0
68a0a81419b57b691d8483d03a58a823,"AI models trained on unsecured code become toxic, study finds",https://techcrunch.com/2025/02/27/ai-models-trained-on-unsecured-code-become-toxic-study-finds/,None,2025-02-27,Techcrunch,AI researchers discovered that training AI models on unsecured code leads to the models giving dangerous advice and behaving undesirably. Models like GPT-4o and Qwen2.5-Coder-32B-Instruct exhibited toxic behavior after being fine-tuned on code containing vulnerabilities.,"AI models, Unsecured code, Toxicity",-0.6,60.0,Negative,"AI Governance, Cybersecurity",None,"OpenAI, Alibaba",None,"GPT-4o, Qwen2.5-Coder-32B-Instruct",None,None,None,None,0.0,Cybersecurity,AI Security,Secure code training Vulnerability detection methods Toxicity mitigation in AI models,AI Safety Vulnerability exploitation Toxic AI,Lack of secure AI training data Need for robust vulnerability detection tools Absence of toxicity mitigation strategies in AI model development,None,None,9.0,8.0
62384b893a2843cf92418949b69b97bb,Meta’s new AR glasses for research can measure heart rate,https://techcrunch.com/2025/02/27/metas-new-ar-glasses-for-research-can-measure-heart-rate/,None,2025-02-27,Techcrunch,"Meta has announced Aria Gen 2, the next generation of its AR glasses designed for research, featuring upgraded sensors, custom silicon, heart rate measurement, and voice isolation. The glasses will be available to academic and commercial research labs.","AR Glasses, Meta, Heart Rate Monitoring",0.6,70.0,Positive,"Augmented Reality, Wearable Technology, Research",None,"Meta, Envision",None,Aria Gen 2,None,B2B,None,None,0.0,Generative AI,AR/VR,AI-powered eye tracking hand tracking speech recognition force-canceling speakers,Augmented Reality Wearable Health Monitoring AI Integration,None,None,Researchers and developers require advanced AR tools with accurate sensor data for health monitoring and accessibility solutions,9.0,7.0
1b6e8a795c6a6a2138675a2dd008a72e,Workhelix taps years of research to help enterprises figure out where to apply AI,https://techcrunch.com/2025/02/27/workhelix-taps-years-of-research-to-help-enterprises-figure-out-where-to-apply-ai/,None,2025-02-27,Techcrunch,"Workhelix, a tech-enabled service startup, helps enterprises understand and monitor AI automation by breaking down employee positions into tasks and scoring their suitability for AI adoption to build AI adoption roadmaps. The company recently raised a $15 million Series A round to expand its software's task and KPI tracking capabilities.","Workhelix, AI adoption, Enterprise AI",0.7,70.0,Positive,"Venture Capital, Artificial Intelligence, Enterprise Software","James Milin, Erik Brynjolfsson, Andrew McAfee, Daniel Rock, Reid Hoffman, Mira Murati, Jeff Dean, Shaun Johnson, Christopher Manning","Workhelix, Stanford's Digital Economy Lab, MIT initiative on the digital economy, Wharton, Accenture, Wayfair, Coursera, AIX Ventures, AI Fund, Accenture Ventures, Bloomberg Beta, LinkedIn, OpenAI, Google DeepMind, Google Research",None,None,Series A Funding,B2B,Series A,"AIX Ventures, AI Fund, Accenture Ventures, Bloomberg Beta",15.0,Generative AI,AI-powered enterprise solutions,AI adoption roadmap task-based AI suitability scoring system,AI Adoption Enterprise AI Generative AI,Lack of systematic rigorous ways to adopt generative AI difficulty unlocking the business side of AI limited tools for monitoring AI automation success,Workhelix differentiates itself from traditional consultants by offering software tools.,Enterprises are hungry for solutions that help them understand and monitor AI automation at their companies and require a systematic approach for AI adoption.,9.0,8.0
758a4a34a5d9f255d69b32c3d280b41f,"TechCrunch Disrupt 2025: Just 2 days left to save up to $1,130",https://techcrunch.com/2025/02/27/techcrunch-disrupt-2025-just-2-days-left-to-save-up-to-1130/,None,2025-02-27,Techcrunch,"TechCrunch Disrupt 2025 is offering discounted tickets until February 28th, providing an opportunity to connect with tech leaders, attend sessions, and witness the Startup Battlefield competition. The event celebrates 20 years of innovation and entrepreneurship.","TechCrunch Disrupt, Startup Battlefield, Innovation",0.7,70.0,Positive,"Venture Capital, Startups, Events",None,"TechCrunch, Trello, Mint, Dropbox, Discord, Cloudflare","San Francisco, USA",None,"TechCrunch Disrupt 2025, Startup Battlefield",None,None,None,0.1,Generative AI,AI Events and Conferences,Global startup competition Networking opportunities,Startup competitions Innovation networking,None,None,Opportunity for startups to gain visibility and funding,7.0,5.0
123a4b5c6d7e8f901234,"Unique, a Swiss AI platform for finance, raises $30M",https://techcrunch.com/2025/02/27/unique-a-swiss-ai-platform-for-finance-raises-30m/,None,2025-02-27,Techcrunch,"Unique, a Swiss AI platform focused on agentic AI for financial services, raised $30 million in Series A funding to expand internationally and further develop its customizable AI agents for automating workflows in areas like research, compliance, and KYC. The company aims to power an agentic AI workforce for banking, insurance, and private equity.","Agentic AI, Financial Services, Series A",0.7,70.0,Positive,"Venture Capital, Fintech AI, Artificial Intelligence","Manuel Grenacher, Michelle Heppler, Andreas Hauri","Unique, DN Capital, CommerzVentures, Commerzbank, Pictet, UBP, Graubündner Kantonalbank","Zurich, Switzerland","Investment research agent, Due diligence agent",Series A Funding,B2B,Series A,"DN Capital, CommerzVentures",30.0,Fintech AI,"RegTech, AI-powered automation",Customizable AI agentsAgentic AI workforce,Agentic AIAutomated WorkflowsAI Copilots,Finance teams lack integrated AICustomizable AI agents unmet demand,None,Demand for automation in researchcompliance and KYCStartups seek AI co-pilots,9.0,7.0
b84a8f1a5f1f4a4b8834c386f6b8059d,Google Gemini: Everything you need to know about the generative AI apps and models,https://techcrunch.com/2025/02/26/what-is-google-gemini-ai/,None,2025-02-26,Techcrunch,"Google is promoting Gemini, its suite of generative AI models, apps, and services, aiming to compete with tools like ChatGPT and Copilot, offering various models trained on multimodal data for diverse applications. It introduces Gemini apps and integrates Gemini features into Google Workspace and other Google services, requiring a Google One AI Premium Plan for advanced functionalities.","Google Gemini, Generative AI, Multimodal AI",0.6,70.0,Positive,"Generative AI, Artificial Intelligence, Machine Learning",Craig Federighi,"Google, DeepMind, Google Research, OpenAI, Meta, Microsoft, Apple",None,"Gemini, Gemini Pro, Gemini Flash, Gemini Nano, Gemini Advanced, ChatGPT, Llama, Copilot, Google Assistant, Gemini Live, Pixel Buds Pro 2, Code Assist, Gemini in Threat Intelligence, Apple Intelligence, Google Docs, Gmail, Google Sheets, Google Slides, Google Maps, Firebase, Project IDX, Google Photos, YouTube, Google Meet, Gboard, Vertex AI, AI Studio, NotebookLM, Google One AI Premium Plan",WWDC 2024,B2C,None,None,20.0,Generative AI,"AI Chatbots, AI Development Platforms",Deep Research Gembased chatbots Gemini extensions Gemini Live multimodal integration,Generative AI Multimodal AI AI integration into existing platforms Custom AI assistants On-device AI processing,Lack of fix for encoded biases and hallucinations Underlying problems with generative AI technology,"Google’s Gemini is compared to OpenAI’s ChatGPT, Meta’s Llama, and Microsoft’s Copilot. Apple is in talks to put Gemini to use for a number of features in its Apple Intelligence suite.","Users can use Gemini to write emails and summarize message threads, write and refine content and brainstorm new ideas, generate slides and custom images, track and organize data, creating tables and formulas, aggregate reviews about local businesses and offer recommendations like how to spend a day visiting a foreign city.",10.0,8.0
6f5902ac3b4ff20b138a247c40c118d8,Apple iPhone 16e review: An A18 chip and Apple Intelligence for $599,https://techcrunch.com/2025/02/26/apple-iphone-16e-review-an-a18-chip-and-apple-intelligence-for-599/,None,2025-02-26,Techcrunch,"Apple released the iPhone 16e, a budget-friendly handset featuring the A18 chip and Apple Intelligence, aiming to offer a reliable option at a lower cost. The phone incorporates features from earlier iPhones while introducing Apple's custom C1 modem and prioritizing AI capabilities.","iPhone 16e, Apple Intelligence, A18 chip",0.4,65.0,Positive,"Mobile Technology, Consumer Electronics, Artificial Intelligence",Tim Cook,Apple,None,"iPhone 16e, iPhone 16, iPhone 15, Apple Intelligence, Image Playground, Visual Intelligence",None,B2C,None,None,0.599,Consumer Electronics,Mobile Devices,Custom C1 modem integrated telephoto computational photography AI-powered features budget-friendly flagship phone,Generative AI Budget-friendly flagships Computational photography On-device AI processing,Demand for affordable iPhones with flagship AI capabilities user concerns about compromises in camera and display technology missing compact iPhone option,Apple faces competition from domestic manufacturers in China and competes with Android manufacturers in the mid-tier market.,Customers prioritize affordability and AI capabilities while some value advanced features like dual cameras and high-brightness displays.,9.0,7.0
f4d201a52b776d6141916c8e677338e7,Lonestar and Phison’s data center infrastructure is headed to the moon,https://techcrunch.com/2025/02/26/lonestar-and-phisons-data-center-infrastructure-is-headed-to-the-moon/,None,2025-02-26,Techcrunch,"Lonestar and Phison launched a data center infrastructure to the moon on a SpaceX rocket, aiming to create a lunar data center with petabyte storage to offer secure data storage immune from terrestrial disasters and hacking. The companies plan to expand their lunar data center project in the future, collaborating with Sidus Space to build six data storage spacecraft.","Lunar Data Center, Space Storage, SpaceX",0.7,80.0,Positive,"Space Tech, Data Storage, Venture Capital","Chris Stott, Michael Wu","Lonestar, Phison, SpaceX, NASA, Y Combinator, Sidus Space",None,Phison Pascari SSDs,None,B2B,Seed,None,21.0,Space Tech,Lunar Data Storage,Lunar data centers space-based storage custom SSD solutions for space missions,Space data centers off-Earth data storage AI-driven data center demand,Lack of secure off-Earth data storage solutions need for data resilience against terrestrial disasters,Lonestar competes with Starcloud (formerly Lumen Orbit) in the space-based data center market.,Governments and companies seek off-Earth data storage for disaster recovery and security. Space agencies are testing large language models in space.,9.0,8.0
49a321c4c1735b612416471d322821b4,Nvidia CEO Jensen Huang shrugs off DeepSeek as sales soar,https://techcrunch.com/2025/02/26/nvidia-ceo-jensen-huang-shrugs-off-deepseek-as-sales-soar/,None,2025-02-26,Techcrunch,"Nvidia CEO Jensen Huang dismisses concerns that DeepSeek's R1 model will impact Nvidia's sales, highlighting that reasoning models like R1 drive significant compute demand. Nvidia reported record-breaking revenue of $39.3 billion and anticipates continued growth, driven by strong demand for its Blackwell chip.","Nvidia, DeepSeek, Blackwell chip",0.7,70.0,Positive,"AI Chips, Semiconductor Industry, Artificial Intelligence",Jensen Huang,"Nvidia, DeepSeek, Meta, Google, Amazon",None,"Blackwell chip, DeepSeek R1",None,B2B,None,None,115.0,Semiconductor Industry,AI Accelerators,Reasoning AI models Custom-built chips for AI reasoning Open-sourcing AI models,AI infrastructure investments Reasoning AI models,Demand for more compute-intensive AI reasoningmodels,"Nvidia competes with DeepSeek, but Huang dismisses concerns about DeepSeek's impact on Nvidia's sales.",AI developers are applying R1 Reasoning models are great news for Nvidia since they need so much more compute,9.0,7.0
a93f89a92646c4d6967009f994877c33,"With Alexa+, Amazon makes an intriguing play in the consumer agent space",https://techcrunch.com/2025/02/26/with-alexa-amazon-makes-an-intriguing-play-in-the-consumer-agent-space/,None,2025-02-26,Techcrunch,"Amazon is launching Alexa+, an AI agent designed to handle everyday tasks by integrating with first- and third-party apps, aiming to be the first comprehensive, consumer-focused agent tool. The company hopes to leverage generative AI to create a more natural and autonomous assistant.","Alexa+, AI Agents, Generative AI",0.6,70.0,Positive,"AI, Consumer Technology, Artificial Intelligence",Daniel Rausch,"Amazon, Anthropic, OpenAI, Google","New York, USA","Alexa, Alexa+, ChatGPT, Gemini",None,B2C,None,None,0.0,Generative AI,"AI Assistants, Consumer AI",Agentic AI capabilities for autonomous task management Interoperable AI agents,AI Agents Generative AI Personalized Experiences,Reliability of AI agents performing tasks accurately Hallucinations in AI generated content,"Alexa+ competes with agents from Anthropic, OpenAI, and Google, including ChatGPT and Gemini.","Users want AI agents to seamlessly handle mundane tasks and improve productivity, expecting personalized and tailored experiences while still struggling with errors.",9.0,7.0
c8c3997839f87e03e9698b395148012f,Inception emerges from stealth with a new type of AI model,https://techcrunch.com/2025/02/26/inception-emerges-from-stealth-with-a-new-type-of-ai-model/,"Stefano Ermon, Aditya Grover, Volodymyr Kuleshov",2025-02-26,Techcrunch,"Inception, founded by Stanford professor Stefano Ermon, is developing a diffusion-based large language model (DLM) that promises faster performance and reduced computing costs compared to traditional LLMs by generating and modifying large blocks of text in parallel.","Diffusion models, Large Language Models, DLM",0.8,80.0,Positive,"Artificial Intelligence, Machine Learning","Stefano Ermon, Aditya Grover, Volodymyr Kuleshov","Inception, Stanford, UCLA, Cornell, Mayfield Fund, Midjourney, OpenAI, Meta","Palo Alto, USA","DLM, GPT-4o, Llama 3",None,B2B,None,Mayfield Fund,0.0,Generative AI,Large Language Models,Diffusion-based large language model,Generative AI Parallel text generation Reduced AI latency Increased AI speed,Need for reduced AI latency and increased speed Efficiency in GPU utilization and cost-effectiveness Improvement in tokens per second performance,Inception's 'small' coding model is as good as OpenAI’s GPT-4o mini while more than 10 times as fast and their 'mini' model outperforms small open-source models like Meta’s Llama 3,Fortune 100 companies need reduced AI latency and increased speed,10.0,8.0
e5f7b9a0a7b8c2d1e3f4a5b6c7d8e9f0,No Title Found,https://techcrunch.com/podcast/how-gradient-ventures-is-shaping-the-ai-startup-landscape-with-eylul-kayin/,None,Unknown,Techcrunch,"Eylul Kayin from Gradient Ventures discusses the AI startup landscape, focusing on the need for speed and durability in AI startups, quality product offerings, and the rapid pace of AI innovation. Gradient Ventures, founded by Google in 2017, invests in early-stage AI companies.","AI startups, Gradient Ventures, Seed-stage investments",0.7,70.0,Positive,"Venture Capital, Artificial Intelligence, Startups","Eylul Kayin, Mary Ann Azevedo, Theresa Loconsolo","Gradient Ventures, Google, TechCrunch, Apple, Spotify","San Francisco, USA",None,None,B2B,Seed,Gradient Ventures,0.0,Generative AI,AI Venture Funding,Fast launch durable AI startups Quality AI product offerings,AI Startups Early Stage Investment,None,None,Startups need speed and durability in AI solutions.,9.0,7.0
8a97e3046412e3a073496a96c9a102d1,ElevenLabs is launching its own speech-to-text model,https://techcrunch.com/2025/02/26/elevenlabs-is-launching-its-own-speech-to-text-model/,None,2025-02-26,Techcrunch,"ElevenLabs, known for its audio generation, is launching its first stand-alone speech-to-text model called Scribe, supporting over 99 languages and competing with existing models like OpenAI's Whisper. The model includes features such as speaker diarization, word-level timestamps, and auto-tagging of sound events, priced at $0.40 per hour of transcribed audio.","Speech-to-text, ElevenLabs, Scribe",0.6,70.0,Positive,"Artificial Intelligence, Speech Recognition, Language Processing",Mati Staniszewski,"ElevenLabs, Gladia, Speechmatics, AssemblyAI, Deepgram, OpenAI, Google",None,"Scribe, Whisper, Gemini 2.0 Flash",None,B2B,None,None,180.0,Generative AI,Speech Recognition AI,Smart speaker diarization Word-level timestamp Auto-tagging sound events Video transcription,AI conversational agents Improved speech detection models Low-latency real-time transcription,Need for better speech detection models for many languages Demand for low-latency real-time transcription Solutions for direct video content transcription,"ElevenLabs competes with Gladia, Speechmatics, AssemblyAI, Deepgram, and OpenAI’s Whisper models. The model outperformed Google Gemini 2.0 Flash and Whisper Large V3 across multiple languages in FLEURS & Common Voice benchmark tests.","Customers need accurate subtitles and captions for video content and improved speech detection for various languages, especially for those languages with error rate is less than 5%",9.0,7.0
689b92a7c51a248a011d5d2a8b5a3d1a,"Amazon Alexa+ can read, summarize and recall lengthy documents",https://techcrunch.com/2025/02/26/alexa-can-read-summarize-and-recall-lengthy-documents/,None,2025-02-26,Techcrunch,"Amazon has unveiled Alexa+, an upgraded version of its voice assistant powered by generative AI, capable of reading, summarizing, and recalling details from user-uploaded documents, as well as managing calendars and controlling smart home devices.","Generative AI, Alexa+, Document Summarization",0.6,70.0,Positive,"Artificial Intelligence, Voice Assistants, Smart Home",Mara Segal,Amazon,None,"Alexa+, Prime Video",Devices & Services Event,B2C,None,None,0.0,Generative AI,AI Voice Assistants,AI-powered document summarization Contextual information extraction Integration with smart home devices Enhanced voice assistant capabilities,Generative AI Voice Assistants Smart Home Integration AI-Powered Productivity,Privacy concerns in AI-driven personal assistants Need for accurate information extraction in diverse document types Limited personalized experiences in voice assistants,None,Users seek efficient ways to manage information overload and simplify complex tasks through AI assistants Demand for voice-controlled solutions for smart home management and productivity,9.0,7.0
67cf224b89a0a1505498f82e54b9d2d5826064b2,"Amazon Alexa+ costs $19.99, free for Prime members",https://techcrunch.com/2025/02/26/amazon-alexa-costs-19-99-free-for-prime-members/,None,2025-02-26,Techcrunch,"Amazon is launching Alexa+, a new and improved Alexa experience powered by generative AI, priced at $19.99 per month or free for Amazon Prime subscribers, along with a new web experience (Alexa.com) and a refreshed mobile app.","Alexa+, Amazon Prime, Generative AI",0.5,70.0,Positive,"Generative AI, Voice Assistants, Consumer Tech",Panos Panay,"Amazon, OpenAI, Google","NYC, USA","Alexa+, Echo Show, Echo Dot, Echo Pop, ChatGPT, Gemini",None,B2C,None,None,19.99,Generative AI,Voice AI Assistants,Generative AI-powered Alexa Enhanced web experience Refreshed mobile app,Generative AI Voice assistant integration AI-powered chatbots,Demand for AI assistants with long-form capabilities Need for affordable generative AI integration,Alexa+ pricing is compared to OpenAI's ChatGPT and Google's Gemini Advanced.,"Consumers seek value and are potentially willing to pay for enhanced AI assistant functionality, particularly within existing subscription models like Amazon Prime.",9.0,7.0
720963c6873231c199328b7a508697c5,Amazon’s new Alexa+ brings AI-powered ‘Explore’ and ‘Stories’ features for kids,https://techcrunch.com/2025/02/26/amazons-new-alexa-brings-ai-powered-explore-and-stories-features-for-kids/,None,2025-02-26,Techcrunch,"Amazon is launching AI-powered ""Explore with Alexa"" and ""Stories with Alexa"" features for Amazon Kids+ subscribers, designed to help kids explore topics and encourage imaginative thinking through interactive conversations and storytelling.","Alexa+, Amazon Kids+, AI-powered features",0.7,70.0,Positive,"AI, Education, Children's Technology",Mara Segal,Amazon,"New York, USA","Explore with Alexa, Stories with Alexa, Amazon Kids+, Alexa+",None,B2C,None,None,0.0,Edtech,AI-Powered Learning Platforms,AI-driven imaginative storytelling personalized learning experiences interactive educational exploration,AI-powered education personalized learning child-friendly AI,Privacy-focused AI for children development of truly engaging educational AI AI that fosters creativity,None,"Parents seek engaging and educational AI tools for children, demand for interactive and imaginative learning experiences",9.0,7.0
