article_id,title,link,author,publication_date,source,summary,keywords,sentiment_score,sentiment_percentage,sentiment_analysis,topics,people,organizations,locations,products,events,business,funding_rounds,investors,financial_metrics,sectors,sub_sectors,innovations,trends,market_gaps,competitor_analysis,customer_insights,relevance_score,severity_score
5e9d8c1a2b3f47689d6a543c12345678,"Sesame, the startup behind the viral virtual assistant Maya, releases its base AI model",https://techcrunch.com/2025/03/13/sesame-the-startup-behind-the-viral-virtual-assistant-maya-releases-its-base-ai-model/,None,2025-03-13,Techcrunch,"Sesame, an AI company, has released CSM-1B, the base model behind its impressively realistic voice assistant, Maya, under an Apache 2.0 license for commercial use; the model generates RVQ audio codes from text and audio inputs, using a model from Meta’s Llama family as its backbone.","Voice cloning, Base AI model, CSM-1B",0.1,30.0,Positive,"Artificial Intelligence, Voice Technology, Open Source",Brendan Iribe,"Sesame, Google, Meta, OpenAI, Andreessen Horowitz, Spark Capital, Matrix Partners",None,"Maya, CSM-1B, SoundStream, Encodec, Llama",None,B2B,None,"Andreessen Horowitz, Spark Capital, Matrix Partners",0.0,Generative AI,"Voice Cloning, AI Assistants",Voice cloning tech AI glasses for all day use,Voice cloning AI assistants,Safeguards to prevent voice cloning abuse are needed,Sesame's Maya is comparable to OpenAI's Voice Mode.,"High demand for realistic voice cloning tech, concerns about potential misuse.",9.0,7.0
54f4f7618a57c0748685a8a0e84f1549,Google calls for weakened copyright and export rules in AI policy proposal,https://techcrunch.com/2025/03/13/google-calls-for-weakened-copyright-and-export-rules-in-ai-policy-proposal/,None,2025-03-13,Techcrunch,Google released an AI policy proposal advocating for weaker copyright restrictions on AI training and balanced export controls. The proposal emphasizes the importance of international economic policy to support AI innovation and cautions against overregulation that could hinder competitiveness.,"AI Policy, Copyright, Export Controls",-0.2,20.0,Negative,"AI Governance, Policy, Regulation",None,"Google, OpenAI, Microsoft",None,None,None,B2B,None,None,0.0,AI Governance,AI Regulation,Balanced export controls for AI chips Comprehensive federal AI legislation Government datasets release for commercial AI training,"AI Regulation, Data Privacy, AI Ethics",Lack of clarity on AI developer liability Inconsistent AI regulations across states Onerous obligations around AI systems,Google's stance on export controls contrasts with Microsoft's.,AI developers seek clarity on liability and risk management Deployers want instructions on operation limitations risks associated with the model,9.0,7.0
f78314ff467375e94572e09878b712931d9cf9dd,"OpenAI calls DeepSeek ‘state-controlled,’ calls for bans on ‘PRC-produced’ models",https://techcrunch.com/2025/03/13/openai-calls-deepseek-state-controlled-calls-for-bans-on-prc-produced-models/,None,2025-03-13,Techcrunch,"OpenAI is advocating for the U.S. government to ban AI models from DeepSeek, a Chinese AI lab, alleging it's state-controlled and poses security risks due to Chinese law requirements for user data compliance. They claim PRC-produced models pose privacy and security risks, potentially including IP theft.","OpenAI, DeepSeek, AI Governance",-0.3,30.0,Negative,"AI Governance, International Relations, Cybersecurity","Liang Wenfeng, Xi Jinping","OpenAI, DeepSeek, High-Flyer, Microsoft, Perplexity, Amazon",None,R1 reasoning model,None,None,None,None,0.0,AI Governance,None,None,AI Governance,Lack of transparency in AI model development,OpenAI competes with DeepSeek.,"Startups and companies are increasingly concerned about data privacy and security risks associated with AI models, especially those potentially influenced by foreign governments.",9.0,8.0
30a808a913095329294d843c6a070c323f6c4b24,Google wants Gemini to get to know you better,https://techcrunch.com/2025/03/13/google-wants-gemini-to-get-to-know-you-better/,None,2025-03-13,Techcrunch,"Google is launching Gemini with personalization, a new capability for its Gemini chatbot apps that leverages user data from other Google apps and services to deliver customized responses. The company also announced updated models, research capabilities, and app connectors for the Gemini platform.","Gemini, Google Search, Personalization",0.5,70.0,Positive,"Artificial Intelligence, Chatbots, Personalization",Dave Citron,"Google, OpenAI, Amazon",None,"Gemini, Gemini Advanced, Gemini 2.0 Flash Thinking Experimental, Google Search, Google Photos, YouTube, ChatGPT, Alexa",None,B2C,None,None,20.0,Generative AI,AI Chatbots,Personalized chatbot responses based on user data integrationwith Google Search integration with Google Photos and YouTube integration with Google Calendar Notes and Tasks context window of 1-million-tokenstandalone version of 2.0 Flash Thinking Experimental enhanced Deep Researchwith exposed thinking steps and 2.0 Flash Thinking Experimental Gems customizable chatbots within Gemini interactionwith Google Photos,"AI Personalization, AI Chatbots, Large Language Models",User privacy concerns with personalized AI Lack of transparency in data usage Limited free access to advanced AI features,Google competes with OpenAI and Amazon in the AI chatbot market.,Early testers find personalized recommendations and brainstorming helpful. Users are concerned about privacy implications of AI using personal data.,9.0,7.0
a1b2c3d4e5f6,OpenAI’s ‘creative writing’ AI evokes that annoying kid from high school fiction club,https://techcrunch.com/2025/03/13/openais-creative-writing-ai-evokes-that-annoying-kid-from-high-school-fiction-club/,None,2025-03-13,Techcrunch,"OpenAI trained an AI model for creative writing, but its output is criticized for lacking depth and originality, resembling amateurish high school fiction. The article explores the ethical and artistic implications of AI-generated literature, highlighting its inability to replicate genuine human experience.","Generative AI, Creative Writing, OpenAI",-0.3,30.0,Negative,"Generative AI, AI Ethics, Copyright","Sam Altman, Tuhin Chakrabarty, Simon Willison, Linda Maye Adams, Michelle Taransky","OpenAI, Stony Brook, The New York Times, Author’s Guild, University of Pennsylvania",None,ChatGPT,None,None,None,None,0.0,Generative AI,AI-Generated Content,AI-driven metafiction writingAI analysis of literary styles,"Generative AI, AI-assisted writing tools, Copyright concerns in AI training data","Authenticity and originality in AI writing, Lack of emotional depth and human experience in AI-generated content, Addressing copyright issues in AI training dataNone",None,"Readers question the emotional investment in AI-written content, Authors worry about AI's impact on creativity and originality, Educators can identify AI-generated content due to lack of originality.",9.0,7.0
78e7310a503068653b2a0122c91d25d9,5 ways TechCrunch Sessions: AI will fuel your AI growth,https://techcrunch.com/2025/03/13/5-ways-techcrunch-sessions-ai-will-fuel-your-ai-growth/,None,2025-03-13,Techcrunch,"TechCrunch Sessions: AI event on June 5 at UC Berkeley will gather AI experts, investors, and enthusiasts to exchange ideas and explore AI innovations. The event includes main stage discussions, breakout sessions, networking opportunities, and an expo hall showcasing the latest AI technologies.","AI event, AI innovation, AI networking",0.7,80.0,Positive,"Artificial Intelligence, Events, Technology","Jae Lee, Oliver Cameron, Kanu Gulati","Twelve Labs, Odyssey, Khosla Ventures, TechCrunch, UC Berkeley","Berkeley, USA",None,TechCrunch Sessions: AI,None,None,Khosla Ventures,0.0,Generative AI,None,AI infused side events AI breakthroughs showcase,AI events AI networking,None,None,"AI professionals and enthusiasts are eager to connect, explore new technologies, and gain insights into AI innovations.",9.0,6.0
79f34f89f74815f47a52b924e65c6d60,Xbox debuts a new AI-powered gaming companion for mobile users,https://techcrunch.com/2025/03/13/xbox-debuts-a-new-ai-powered-gaming-companion/,None,2025-03-13,Techcrunch,"Xbox is experimenting with an AI-powered gaming sidekick called ""Copilot for Gaming"" designed to enhance the gaming experience by answering questions, completing tasks, and providing real-time tips. The AI companion integrates with the Xbox mobile app to offer assistance and personalized recommendations.","AI Gaming Companion, Copilot for Gaming, Xbox",0.6,70.0,Positive,"Artificial Intelligence, Gaming, Mobile Technology",Fatima Kardar,"Xbox, Microsoft, Google DeepMind, Sony PlayStation",None,"Copilot for Gaming, SIMA, Aloy",Game Developers Conference (GDC),B2C,None,None,0.0,Generative AI,AI Gaming,AI-powered gaming companion realtime gameplay tips personalized game recommendations voice-activated assistant adapts to gameplay style,AI Companions AI-Powered Gaming Personalized Gaming Experiences,Limited AI integration with mobile gaming Personalized realtime assistance for players Lack of adaptive gaming companions,Xbox's Copilot for Gaming competes with Google DeepMind's SIMA and Sony PlayStation's AI-powered Aloy.,Gamers seek personalized real-time assistance and adaptive companions to enhance their gaming experience.,9.0,7.0
247f5444224b9837e8c887260d472f99f87e28d9,OpenAI calls for US government to codify ‘fair use’ for AI training,https://techcrunch.com/2025/03/13/openai-calls-for-u-s-government-to-codify-fair-use-for-ai-training/,None,2025-03-13,Techcrunch,"OpenAI is advocating for the U.S. government to codify 'fair use' principles to ensure AI models can continue learning from copyrighted material, arguing this is crucial for maintaining America's leadership in AI innovation. Content owners who’ve sued OpenAI for copyright infringement will no doubt take issue with the company’s latest reassertion of this stance.","OpenAI, Fair Use, AI Training",0.2,30.0,Positive,"AI Governance, Legal Tech",None,OpenAI,None,None,None,None,None,None,0.0,AI Governance,None,Permissive laws regulations around AI training,AI development Copyright law,Lack of clear legal framework for AI training data,None,Content creators concerned about copyright infringement from AI training,9.0,7.0
94557829e7c486e88cf1c5414d2c9c87,UiPath looks for a path to growth with Peak agentic AI acquisition,https://techcrunch.com/2025/03/13/uipath-is-looking-for-a-path-to-growth-in-agentic-ai-with-its-peak-ai-acquisition/,None,2025-03-13,Techcrunch,"UiPath acquired Peak.ai, a startup specializing in ""decision-making"" AI for retail and manufacturing, to enhance its AI and automation services and bolster revenue growth amidst increasing global macroeconomic uncertainty.","Agentic AI, UiPath, Peak.ai",0.2,60.0,Positive,"Artificial Intelligence, Business Automation, Acquisitions","Daniel Dines, Richard Potter, David Leitch, Atul Sharma, Robert Anton","UiPath, Peak.ai, SoftBank, Octopus, MMC, OurCrowd, Oxx, Companies House","Manchester, England","UiPath Platform, Peak decision-making AI, RPA",None,B2B,None,"SoftBank, Octopus, MMC, OurCrowd",75.0,Robotics & Automation,Enterprise Automation,Vertical AI solutions Decision intelligence integration with automation,Agentic AI Business automation Vertical AI,AI perceived as a gamble at times by would be customers Need for seamless integration of decision intelligence with automation,None,"Would-be customers saw AI as a gamble, but that perception had started to shift User demand for seamless integration of AI with existing business processes",9.0,7.0
6b86b273ff34fce19d6b804eff5a3f5747ada4eaa22f1d49c01e52ddb7875b4b,Singapore grants bail for Nvidia chip smugglers in alleged $390M fraud,https://techcrunch.com/2025/03/13/singapore-grants-bail-for-nvidia-chip-smugglers-in-alleged-390m-fraud/,None,2025-03-13,Techcrunch,"Three men in Singapore have been granted bail after being charged with smuggling Nvidia chips and committing fraud against Dell and Super Micro, by falsely stating where the servers would be located; Singapore prosecutors said the fraud case involved servers provided by Singaporean companies and then moved to Malaysia, with transactions totaling about $390 million.","Nvidia chips, Chip smuggling, Export rules",-0.3,40.0,Negative,"Supply Chain, Geopolitics, Fraud",None,"Nvidia, Dell, Super Micro, DeepSeek","Singapore, Singapore","Nvidia chips, Server computers",None,B2B,None,None,390.0,Supply Chain & Logistics,Semiconductor Supply Chain,None,"Supply Chain Resilience, Geopolitical Risk",Transparency in cross-border technology transfers is lacking Export regulation loopholes persist Supply chain vulnerabilities exist,"DeepSeek's AI is powered by Nvidia's chips, despite efforts to restrict exports and prevent the technology from being used in China",Heightened concerns exist around how and where companies source chips Singapore accounted for 18% of Nvidia's revenue despite shipments to the country making up less than 2% of sales,8.0,7.0
87b7d559168308f4b2b1507c6233a2f2,Bria lands new funding for AI models trained on licensed data,https://techcrunch.com/2025/03/13/bria-lands-new-funding-for-ai-models-trained-on-licensed-data/,None,2025-03-13,Techcrunch,"Bria, an AI startup developing image generators trained exclusively on licensed content, raised $40 million in Series B funding to expand its platform and models. The company aims to foster an 'IP ecosystem' where businesses can access licensed images for commercial creations with built-in compliance.","Generative AI, Licensed Data, Image Generators",0.7,70.0,Positive,"Venture Capital, Generative AI, Copyright","Yair Adato, Assa Eldar","Bria, Getty Images, Red Dot Capital, Maor Investments, Entrée Capital, GFT Ventures, Intel Capital, IN Venture, Adobe, Spawning AI, Shutterstock, Photoshop, Figma","New York, USA","Image Generators, Fine-tuning API, Photoshop, Figma",Series B Funding,B2B,Series B,"Red Dot Capital, Maor Investments, Entrée Capital, GFT Ventures, Intel Capital, IN Venture",40.0,Generative AI,Generative Image Models,AI models trained on licensed data Compensating image owners programmatically,Generative AI Licensed Content IP Ecosystem,Need for copyright-compliant AI models Demand for diverse and unbiased visual content Desire for IP-safe generative AI solutions,"Bria competes with Adobe, Spawning AI, and Shutterstock in the licensed media generators market.",Enterprise customers seek custom engines that maintain their visual identity; Users want AI-generated content that reflects diversity.,9.0,7.0
3684238acb445ca540e7739c05904ff072206939,"As Intel welcomes a new CEO, a look at where the company stands",https://techcrunch.com/2025/03/12/as-intel-welcomes-a-new-ceo-a-look-at-where-the-company-stands/,None,2025-03-12,Techcrunch,"Intel has appointed Lip-Bu Tan as its new CEO following Pat Gelsinger's retirement amidst significant challenges, including a missed AI boom and workforce reductions; despite setbacks, Intel secured a $7.865 billion grant for domestic semiconductor manufacturing and saw success with its Arc B580 graphics card.","Intel, Semiconductors, Chip Manufacturing",0.1,60.0,Positive,"Semiconductors, Business, Manufacturing","Lip-Bu Tan, Pat Gelsinger, David Zinsner, Michelle Johnston Holthaus","Intel, Cadence Design Systems, AMD, Xilink, Analog, Maxim, Tower Semiconductor, U.S. Department of Commerce","Arizona, USA","Arc B580 graphics card, Falcon Shores AI chip",None,B2B,None,None,35.0,AI in Manufacturing,Semiconductor Manufacturing,Integrated device manufacturing model Independent chip foundry,Domestic chip manufacturing,Lack of agility in capitalizing on AI boom Oversized headcount,"Intel falling behind its peers in the semiconductor race, AMD acquiring Xilink, Analog buying Maxim",Positive early reviews led to the sell-out of Intel's Arc B580 graphics card,8.0,7.0
e9d71f552a0119001ca998f642c3a10920f89acb,Anthropic CEO says spies are after $100M AI secrets in a ‘few lines of code’,https://techcrunch.com/2025/03/12/anthropic-ceo-says-spies-are-after-100m-ai-secrets-in-a-few-lines-of-code/,None,2025-03-12,Techcrunch,"Anthropic's CEO, Dario Amodei, expresses concerns about Chinese espionage targeting U.S. AI companies to steal valuable algorithmic secrets, urging the U.S. government to enhance security measures and collaborate with AI industry leaders.","AI Security, Industrial Espionage, Algorithmic Secrets",-0.3,30.0,Negative,"AI Governance, Cybersecurity, Geopolitics",Dario Amodei,"Anthropic, Council on Foreign Relations, White House Office of Science and Technology Policy (OSTP), DeepSeek",USA,None,None,None,None,None,100.0,AI Governance,AI Security,Enhanced security measures for frontier AI labs,"AI Security, Geopolitical tensions in AI, Export controls on AI chips",Need for stronger AI security protocols Lack of collaboration between US and China on AI safety,DeepSeek's performance on bioweapons data safety test compared to Anthropic,AI companies are vulnerable to espionage and require government support for security,9.0,8.0
8f77a9965a6131ef18d4a9f9c97c9384,"How to watch Nvidia GTC 2025, including CEO Jensen Huang’s keynote",https://techcrunch.com/2025/03/12/how-to-watch-nvidia-gtc-2025-including-ceo-jensen-huangs-keynote/,None,2025-03-12,Techcrunch,"Nvidia's GTC 2025 conference will feature a keynote by CEO Jensen Huang, expected to reveal details on the Blackwell Ultra GPU series and next-gen Rubin chip architecture, with focuses on automotive, robotics, and AI updates. The event includes virtual and on-demand sessions covering various topics like large language model customization and generative AI for banking.","Nvidia, GTC 2025, Jensen Huang",0.7,70.0,Positive,"AI, Semiconductors, Robotics",Jensen Huang,Nvidia,"San Jose, USA","Blackwell Ultra, Rubin chip architecture",GTC 2025,None,None,None,0.0,Generative AI,AI Hardware,Next-gen Rubin chip architecture efficient large language model customization generative AI for banking,"Generative AI, Large Language Models, AI applications",None,None,None,9.0,8.0
5f6a7b8c9d2e1a3456789012,Nvidia GTC 2025: What to expect from this year’s show,https://techcrunch.com/2025/03/12/nvidia-gtc-2025-what-to-expect-from-this-years-show/,None,2025-03-12,Techcrunch,"Nvidia's GTC 2025 conference is expected to feature announcements on AI, accelerated computing, robotics, sovereign AI, AI agents, and automotive, with a keynote from CEO Jensen Huang focusing on advancements in GPU technology and future architectures. The event will likely reveal more about the Blackwell Ultra and Rubin GPU series, as well as Nvidia's approach to quantum computing.","Nvidia, GTC, Blackwell Ultra",0.5,70.0,Positive,"Semiconductors, Artificial Intelligence, Robotics",Jensen Huang,"Nvidia, SAP, AMD, OpenAI, DeepSeek","San Jose, USA","Blackwell B300, Blackwell Ultra, Rubin, Rubin Ultra",GTC 2025,B2B,None,None,39.3,Semiconductors,GPU Technology,AdvancementsinGPUarchitectureQuantumcomputingintegrationSovereignAIdevelopment,AcceleratedComputingSovereignAIQuantumComputingAI Agents,AddressingGPUoverheatingissuesMitigatingexportcontrolimpactsMaintainingGPUmarketshareamidcompetition,"AMD encroaching on Nvidia's territory, DeepSeek's rise impacting GPU demand, Nvidia competing with OpenAI in reasoning models","Customers desire higher computing performance and more memory for AI models, demand for powerful GPUs remains strong despite competition.",9.0,7.0
276922e6f27a68e5b4cf12e412ca320ca55b327d,Google DeepMind unveils new AI models for controlling robots,https://techcrunch.com/2025/03/12/google-deepmind-unveils-new-ai-models-for-controlling-robots/,None,2025-03-12,Techcrunch,"Google DeepMind introduced Gemini Robotics, a new AI model designed to improve robots' ability to interact with objects and navigate environments, alongside Gemini Robotics-ER for researcher use and Asimov, a benchmark for AI robot risk assessment.","Gemini Robotics, DeepMind, Robotics Control",0.6,70.0,Positive,"Robotics & Automation, Artificial Intelligence",None,Google DeepMind,None,"Gemini Robotics, Gemini Robotics-ER, Asimov",None,None,None,None,0.0,Robotics & Automation,Robotics Software,Generalizable robot control Voice-commanded robotic tasks Risk assessment benchmarks for AI robots,"Robotics Control, Generalizable AI, AI benchmarks",Robots need improved dexterity in unstructured environments There is a need for standardized risk assessment for AI robots Developing robust voice command integration is a market gap,None,Demand exists for robots capable of performing a wider range of tasks in diverse settings The need for robust standards and benchmarks is paramount in robotics Customers need a robot that responds to voice commands,9.0,7.0
5b3151c89a87a807e448068e1787958b,"Browser Use, one of the tools powering Manus, is also going viral",https://techcrunch.com/2025/03/12/browser-use-one-of-the-tools-powering-manus-is-also-going-viral/,None,2025-03-12,Techcrunch,"Browser Use, an AI tool that makes websites accessible for AI agents, has seen a surge in popularity due to its integration with the viral AI platform Manus; it experienced a five-fold increase in daily downloads following the unveiling of Manus.","AI agents, Browser Use, Manus",0.7,75.0,Positive,"Artificial Intelligence, Web Technology","Gregor Zunic, Magnus Müller","Butterfly Effect, ETH Zurich, Student Project House, Research and Markets, Deloitte, GitHub","Zurich, Switzerland","Browser Use, Manus",None,B2B,None,None,42000.0,Generative AI,AI Agents,Web agents that navigate websites autonomously Foundation layer for browser agents,AI Agents Web Automation,Need for accessible websites for AI agents,None,"Developers seek tools to build browser agents, businesses anticipate deploying AI agents.",9.0,7.0
58b1930480837a7989d3916a9346598a,Dapr’s microservices runtime now supports AI agents,https://techcrunch.com/2025/03/12/daprs-microservices-runtime-now-supports-ai-agents/,None,2025-03-12,Techcrunch,"Microsoft's Dapr, a runtime for microservice-based applications, now supports AI agents through its new Dapr Agents framework, leveraging Dapr's virtual actors for efficient orchestration and state management. Dapr Agents originated from the Floki project and aims to simplify the development of AI agents by providing essential building blocks and integration with various model providers.","Dapr Agents, AI agents, microservices",0.7,70.0,Positive,"AI, Microservices, Software Development","Yaron Schneider, Mark Fussell, Roberto Rodriguez","Microsoft, AWS, OpenAI, Anthropic, Mistral, Hugging Face",None,"Dapr, Dapr Agents, Floki, AWS Bedrock, OpenAI, Anthropic, Mistral, Hugging Face",None,B2B,None,None,0.0,Generative AI,AI Agents,DaprAgents Microservicesruntime AIAgents lightweight actor-based agents orchestration,AI agents Microservices Distributed systems,Need for orchestration and statefulness in AI agent development Simplified AI agent building blocks,Dapr Agents compete with other agent frameworks by offering orchestration and statefulness capabilities.,Developers need efficient orchestration and state management for building scalable AI agents.,9.0,7.0
6f265e3b1843c87dd9a509349468b6c5,Sakana claims its AI-generated paper passed peer review — but it’s a bit more nuanced than that,https://techcrunch.com/2025/03/12/sakana-claims-its-ai-paper-passed-peer-review-but-its-a-bit-more-nuanced-than-that/,None,2025-03-12,Techcrunch,"Japanese AI startup Sakana claims its AI system, The AI Scientist-v2, generated a paper that passed peer review at an ICLR workshop; however, the company withdrew the paper for transparency and the achievement has nuances because AI made citation errors and didn't undergo meta-review.","AI-generated paper, Sakana, Peer review",0.1,30.0,Positive,"Artificial Intelligence, Research, Ethics","Robert Lange, Matthew Guzdial, Mike Cook","Sakana, University of British Columbia, University of Oxford, ICLR, University of Alberta, King’s College London","Tokyo, Japan",The AI Scientist-v2,ICLR Workshop,None,None,None,0.0,AI Governance,"AI Ethics, AI Research",AI-generated scientific hypotheses experiments data analyses visualizations text and titles AI-generated manuscripts,AI in scientific research AI-generated content AI ethics,Need for norms regarding AI-generated science difficult questions about judging AI-generated science on its own merits avoiding bias against AI science,None,Researchers debate AI's readiness as a co-scientist experts fear AI could generate noise in scientific literature,9.0,7.0
8c98393135385a3b0f41b34b6a68b428,Snap introduces AI Video Lenses powered by its in-house generative model,https://techcrunch.com/2025/03/12/snap-introduces-ai-video-lenses-powered-by-its-in-house-generative-model/,None,2025-03-12,Techcrunch,"Snapchat is launching AI Video Lenses, powered by its in-house generative video model, for Snapchat Platinum subscribers at $15.99 per month, providing users with features currently unavailable on platforms like Instagram and TikTok. The initial Lenses include ""Raccoon"", “Fox”, and “Spring Flowers”.","Generative AI, Video Lenses, Snapchat Platinum",0.6,70.0,Positive,"Generative AI, Social Media, Augmented Reality",None,"Snap, OpenAI, Google",None,"AI Video Lenses, Snapchat Platinum",Partner Summit,B2C,None,None,0.0,Generative AI,Social Media AI,In-house generative video model AI video generation,Generative AI AI-powered lenses,Limited availability of generative AI video features on social media platforms,Snap aims to offer features not yet available on rivals like Instagram and TikTok.,Users desire creative AI tools within familiar social media formats.,9.0,7.0
