article_id,title,link,author,publication_date,source,summary,keywords,sentiment_score,sentiment_percentage,sentiment_analysis,topics,people,organizations,locations,products,events,business,funding_rounds,investors,financial_metrics,sectors,sub_sectors,innovations,trends,market_gaps,competitor_analysis,customer_insights,relevance_score,severity_score
a1b2c3d4e5f6g7h8i9j0,"Why VCs ghost founders, or reject deals and never speak to the founder again",https://techcrunch.com/2025/03/06/why-vcs-ghost-founders-or-reject-deals-and-never-speak-to-the-founder-again/,None,2025-03-06,Techcrunch,"The article explores why venture capitalists sometimes 'ghost' founders after initial contact or meetings, citing reasons such as time constraints, increased volume of pitches, and a shift towards transactional relationships. Several VCs emphasize the importance of honesty and respect in founder interactions, noting that certain behaviors can lead to permanent blacklisting.","Venture Capital, Founder Relations, Deal Rejection",-0.2,20.0,Negative,"Venture Capital, Startup Funding, Investor Relations","Mercedes Bent, Sheel Mohnot, Eric Bahn, Rex Salisbury, Addie Lerner Katz, Andy Grove","Lightspeed Venture Partners, Better Tomorrow Ventures, Hustle Fund, Cambrian Ventures, Andreessen Horowitz, Avid Ventures, Intel",None,None,Money 2020,None,None,"Sequoia Capital, a16z",0.0,Venture Capital,None,Automated email responses for deal opportunities AI-generated outreach,AI-generated content Warm introductions Volume based investing Rapid growth,Genuine investor feedback for founders Personalized VC communication,None,"Founders seek transparent feedback and respectful communication from VCs, while VCs are overwhelmed by the volume of pitches and frustrated by dishonest or disrespectful behavior.",8.0,6.0
398c17e4ef7a3a97d6b0674797aa8c2b,No Title Found,https://techcrunch.com/podcast/is-silicon-valley-still-the-best-place-for-startups-insight-partners-ryan-hinkle-doesnt-think-so/,None,None,Techcrunch,"Ryan Hinkle from Insight Partners challenges the necessity of Silicon Valley as the ultimate startup hub, discussing the evolving startup ecosystem and the post-pandemic shift in founder locations. He argues that while Silicon Valley offers a strong talent pool, the high costs and retention challenges make it not the only viable choice for startups.","Silicon Valley, Startup Ecosystems, Venture Capital",0.2,60.0,Positive,"Venture Capital, Startups, Business","Ryan Hinkle, Julie Bort","Insight Partners, OpenAI, Apple, Overcast, Spotify, TechCrunch","New York, USA",None,None,B2B,None,Insight Partners,12500.0,Venture Capital,None,Decentralized startup hubs post-pandemic Founder relocation strategies,Remote work Rise of alternative startup hubs talent migration,Alternative startup hubs lack same talent pool as Silicon ValleyHigh costs and retention challenges for startups,None,Founders are re-evaluating the necessity of being in Silicon Valley due to high costs and retention challenges.,7.0,5.0
6a9b2d3c1e4f5a6b7c8d9e0f1a2b3c4d,Growth at all costs is destroying the internet. PR maven Ed Zitron says that’s an opportunity for startups.,https://techcrunch.com/2025/03/05/growth-at-all-costs-is-destroying-the-internet-pr-maven-ed-zitron-says-thats-an-opportunity-for-startups/,None,2025-03-05,Techcrunch,"Ed Zitron argues that Big Tech's obsession with growth is creating opportunities for startups to disrupt various industries by offering better user experiences and challenging dominant players like Meta, Microsoft, and Google. He suggests that many areas, including social media, enterprise software, and search, are ripe for disruption.","Startups, Big Tech, User Experience",0.6,70.0,Positive,"Venture Capital, Technology, Business Strategy","Ed Zitron, Elon Musk, Mark Zuckerberg","EZPR, Meta, Microsoft, Salesforce, Dropbox, Zoom, Google, Adobe, DuckDuckGo, Perplexity, Diem, Marginalia Search, OpenSearch, Kagi, Brave, Proton, Tutanota, Skiff, Amazon, Zillow, Canva, Bluesky, Mastodon, TikTok, ByteDance","Silicon Valley, USA","Flashes, Pixelfed, RedNote, Microsoft 365, Google Docs, Gemini, Figma, Affinity, Blender, Google Search, DuckDuckGo, Perplexity, Diem, Marginalia Search, OpenSearch, Kagi, Brave Search, Outlook, Gmail, Yahoo, Microsoft Exchange, Google Workspace, Proton, Tutanota, Skiff, Superhuman, Hey, Shortwave",None,B2B,None,None,0.0,Retail Tech,E-commerce Platforms,Decentralized social media platform Shopify for the delivery side AI-powered search engine with bias detection Privacy-focused search engine with high-quality results,Decentralized Web Privacy-Focused Search AI Integration in Existing Products Consumer Shift Away from Big Tech,Demand for user-centric alternatives to Big Tech platforms Lack of privacy in existing search engines Cluttered user experience in email services,"Bluesky and Mastodon are alternatives to X; Pixelfed challenges Instagram; RedNote challenges TikTok; Perplexity competes with Google Search; Diem fights data bias; Marginalia Search boosts obscure sites; Kagi offers paid, private search; Superhuman, Hey, and Shortwave rethink email UX","Consumers are frustrated with ads and rage-bait on social media, subpar products, and a decline in user experience; users prefer privacy-focused and decentralized services; growing demand for transparent and user-centric technology",9.0,8.0
9578f2a789486e6c72143b5e96f3d8c312f59784,No Title Found,https://techcrunch.com/podcast/can-kevin-rose-and-alexis-ohanian-bring-digg-back/,None,Unknown,Techcrunch,"Kevin Rose, founder of Digg, and Alexis Ohanian, co-founder of Reddit, are relaunching Digg with a new CEO, Justin Mezzell, aiming to modernize the news aggregator with AI-driven moderation and enhancements. The podcast explores the rationale behind the comeback and Digg's future strategy.","Digg, Kevin Rose, Alexis Ohanian",0.6,70.0,Positive,"Social Media, AI, News Aggregation","Kevin Rose, Alexis Ohanian, Justin Mezzell, Connie Loizos","Digg, Reddit, TechCrunch",None,Digg,None,B2C,None,None,0.0,Generative AI,AI-Powered Content Aggregation,AI-driven content moderation AI-enhanced online discourse,AI-driven content moderation News aggregation AI-enhanced online discourse,Need for better online discourse moderation Opportunity for AI-enhanced content experiences Demand for improved news aggregation,Kevin Rose and Alexis Ohanian were former rivals,Demand for better content moderation AI-driven news experiences,8.0,6.0
3a6c66e579d885a3621e799db7dfb522,"African VC LoftyInc Capital launches third fund for seed and Series A, reaches $43M first close",https://techcrunch.com/2025/03/04/loftyinc-capital-launches-third-fund-for-seed-and-series-a/,None,2025-03-04,Techcrunch,"LoftyInc Capital, an African VC firm, has launched its third fund, LoftyInc Alpha, with a $43 million first close to target late-seed and Series A startups across Nigeria, Egypt, Kenya, and Francophone Africa, aiming to bridge the funding gap between pre-seed and Series A stages. The fund will focus on innovations that drive Africa's everyday economy, particularly in financial services, logistics, health tech, retail, climate, and deep tech.","LoftyInc Capital, Series A, African Startups",0.7,70.0,Positive,"Venture Capital, Investment, Startups","Idris Ayo Bello, Marsha Wulff, Michael Oluwagbemi, Mariam Kamel, Kevin Simmons","LoftyInc Capital, Flutterwave, Andela, Wave, Partech, MSMEDA, Anava Fund of Funds, FMO, Proparco (FISEA), AfricaGrow, IFC, First Close Partners, General Atlantic, Meta, TLcom Capital, Norrsken22, Uber","Lagos, Nigeria",None,"Series A Funding, LoftyInc Alpha Launch",B2B,"Seed, Series A","Sequoia Capital, a16z, Sovereign wealth funds from the Middle East and Africa, MSMEDA, Anava Fund of Funds, FMO, Proparco (FISEA), AfricaGrow, IFC, First Close Partners, Meta, TLcom Capital, Partech, Norrsken22",43.0,Fintech AI,Venture Capital,Investment in African Startups targeted support to scale,Investment in African startups expansion to Francophone regions fintech dominance,Low graduation rate from pre-seed to Series A funding gap in late-seed stage,"LoftyInc differentiates itself from other early-stage investors by leveraging operational expertise, networks, and providing market access, business development support, and investor matchmaking.","Startups need structured support to scale and secure Series A capital, creating a demand for firms like LoftyInc.",9.0,7.0
a2f4e8b7d1c90a3b5e67f8a1b3d2c479,"Foundation Capital, an early backer of Solana and Cerebras, raises $600M fund",https://techcrunch.com/2025/03/04/foundation-capital-an-early-backer-of-solana-and-cerebras-raises-600m-fund/,None,2025-03-04,Techcrunch,"Foundation Capital, a venture firm known for early investments in Solana and Cerebras, has raised a $600 million eleventh flagship fund, 20% larger than its predecessor. The firm focuses on seed-stage investing in enterprise, AI, fintech, and crypto, aiming to create new markets with its portfolio companies.","Foundation Capital, Venture Capital, Seed Funding",0.7,75.0,Positive,"Venture Capital, Funding, Investment","Steve Vassallo, Charles Moldow","Foundation Capital, Solana, Cerebras, Nvidia, LendingClub, Rappi, Kiavi, EvolutionIQ, CCC, Venafi, CyberArk",None,None,IPO,B2B,"Seed, Series A","Sequoia Capital, a16z",600.0,Venture Capital,Early Stage Investments,Identifying pre-founders Creating new markets,Early-stage investing Focus on AI and crypto High cash distribution,None,Cerebras competes with Nvidia.,Startups seek investors that create new markets and deliver high cash returns.,7.0,6.0
171b18b907108764771f12c82e76e8d7,"The decline in funding has hit male and female-led startups equally, but women out-raise men in DeepTech",https://techcrunch.com/2025/03/04/funding-to-women-founded-startups-declined-12-in-2024-but-that-wasnt-far-behind-the-broader-market/,None,2025-03-04,Techcrunch,"Venture investment in startups founded by women in Europe declined 12% in 2024, which is nearly in line with the 11% decrease in overall venture investment, and women who founded deep tech startups are raising more than men in that area, according to a Female Foundry report.","Venture Capital, Deep Tech, Female Founders",0.2,60.0,Positive,"Venture Capital, Funding, Entrepreneurship",Agata Nowicka,"Female Foundry, Female Founders, TechCrunch","London, UK",None,Female Innovation Index 2025,None,None,None,0.0,Deep Tech,None,FemaleInnovationIndex,GenderDiversityAcademiaEntrepreneurship,Lackofencouragementforentrepreneurship Lackofdiversitymetrics Lackofaccessforwomen Lackoflevelplayingfield,None,Needformoredetailedmetrics Demandforencouragementtoentrepreneurship Desireforlevelplayingfield,8.0,6.0
988258e28a69245d3aba15c7770f9b40,"General Catalyst loses three top investors as the firm expands beyond venture, contemplates IPO",https://techcrunch.com/2025/03/03/general-catalyst-loses-three-top-investors-as-the-firm-expands-beyond-venture-contemplates-ipo/,None,2025-03-03,Techcrunch,"General Catalyst is experiencing changes, including the departure of three key investors, as it expands beyond venture capital and considers an IPO. The firm is shifting its compensation structure and diversifying its investments into areas like wealth management and healthcare.","General Catalyst, Venture Capital, IPO",-0.2,20.0,Negative,"Venture Capital, Finance, Mergers & Acquisitions","Deep Nishar, Kyle Doherty, Adam Valkin, Jeannette zu Fürstenberg, Neeraj Arora","General Catalyst, La Famiglia, Venture Highway, SoftBank, Vision Fund, LinkedIn, Coatue, Step, Ethos, Rapyd, Shift Technology, ClassPass, MindBody, Axios","Ohio, USA",None,October 2023 merger with La Famiglia,None,None,"SoftBank, Sequoia Capital, a16z",32000.0,Venture Capital,Investment Management,Expanding beyond venture into wealth management and healthcare investment transformation company model strategic shift favoring cash bonuses over equity,"Venture Capital Diversification, Alternative Investments, IPO Contemplation",None,None,"LPs are observing strategic and structural shifts at General Catalyst, impacting investment and compensation strategies.",7.0,6.0
5b3cf73e38b22e62d8cf50c5e6a62a28,Last chance! Last 24 hours to save up to $325 on TechCrunch Sessions: AI,https://techcrunch.com/2025/03/02/last-chance-last-24-hours-to-save-up-to-325-on-techcrunch-sessions-ai/,None,2025-03-02,Techcrunch,"TechCrunch Sessions: AI is offering a limited-time discount on registration, promising insights into the AI world through expert-led sessions, demos, and networking opportunities. The event will feature leaders in the AI industry discussing topics ranging from building on foundational models to venture capital expectations for founders.","AI Event, AI Founders, Foundational Models",0.7,70.0,Positive,"Artificial Intelligence, Venture Capital, Technology Events","Jae Lee, Sara Hooker, Oliver Cameron, Kanu Gulati, Jill Chase, Artemis","Twelve Labs, Cohere, Odyssey, Voyage, Khosla Ventures, PolyAI, Regie, Waabi, Intel, Cadence, ElevenLabs, OpenAI, Meta, CapitalG, Alphabet, Google, Magic, /dev/agents, Motif, Y Combinator, Stanford Graduate School of Business, Mila AI Institute, Kaggle, World Economic Forum","Berkeley, USA",None,TC Sessions: AI,None,"Seed, Series C","Khosla Ventures, CapitalG",0.325,Generative AI,AI Events,Multimodal foundation models AI-powered video intelligence cinematic interactive worlds in real time Responsible AI systems,Generative AI Responsible AI AI Safety AI Investment,None,None,Interest in learning from AI experts and networking with them. Demand for insights into building on existing foundational models and VC expectations.,9.0,7.0
2558206c279d5a303dd76d770685157f,2 days left to save up to $325 on TechCrunch Sessions: AI tickets,https://techcrunch.com/2025/03/01/2-days-left-to-save-up-to-325-on-techcrunch-sessions-ai-tickets/,None,2025-03-01,Techcrunch,"TechCrunch Sessions: AI event is offering discounted tickets until March 2nd, focusing on the startup ecosystem within the AI industry and featuring discussions with leaders, VCs, and enthusiasts at UC Berkeley on June 5th.","TechCrunch Sessions AI, Startup Ecosystem, Artificial Intelligence",0.7,70.0,Positive,"Artificial Intelligence, Venture Capital, Events","Oliver Cameron, Jae Lee, Jill Chase, Kanu Gulati","Odyssey, Twelve Labs, CapitalG, Khosla Ventures, UC Berkeley, Voyage","Berkeley, USA",None,TechCrunch Sessions: AI,None,None,None,0.0,Generative AI,AI Events,Cinematic interactive worlds generation in real time by AI models,AI Models Startup Ecosystem Interactive AI,None,Small companies compete against big players in a fast-paced and rapidly changing space,"AI leaders, VCs, and enthusiasts are seeking invaluable insights alongside the best minds in AI to get inspired and equipped for their next big idea.",9.0,7.0
367c6a9a83271d2a5d97c641f172d5c9,General Catalyst is reportedly weighing a potential IPO,https://techcrunch.com/2025/02/28/general-catalyst-is-reportedly-weighing-a-potential-ipo/,None,2025-02-28,Techcrunch,"General Catalyst, a venture capital firm, is reportedly considering an IPO, potentially accelerating similar plans by other firms like Andreessen Horowitz. The firm has expanded beyond traditional venture investing, launching financing products, wealth management, acquiring a healthcare system, and purchasing other venture firms.","General Catalyst, IPO, Venture Capital",0.4,60.0,Positive,"Venture Capital, Finance, IPO","Hemant Taneja, Neil Sequeira","General Catalyst, Axios, TechCrunch, Demandware, Brightcove, Y Combinator, Airbnb, Stripe, Andreessen Horowitz","Cambridge, USA, Palo Alto, USA, San Francisco, USA, Bengaluru, IND, Ohio, USA",None,IPO,B2B,Series B,None,30000.0,Fintech AI,Venture Capital,Venture capital IPO wealth management financing products healthcare system acquisition,Venture capital growth diversification into finance and healthcare,Access to venture capital for smaller firms healthcare innovation funding diversification in investment strategies,Mention of Andreessen Horowitz as a potential competitor in going public.,Potential investor interest in publicly traded venture capital firms; startups' need for funding and support.,8.0,7.0
b205c6f2c3f81c8d9a9a2a017a8f03c4,Apply to Speak at TechCrunch All Stage 2025,https://techcrunch.com/2025/02/28/apply-to-speak-at-techcrunch-all-stage-2025/,None,2025-02-28,Techcrunch,"TechCrunch is hosting All Stage 2025 in Boston on July 15 and is accepting applications from founders, VCs, and startup experts to speak at the event, sharing their expertise on scaling businesses.","Startups, Venture Capital, Scaling",0.6,70.0,Positive,"Venture Capital, Startups, Events",None,"TechCrunch, Fidelity","Boston, USA",None,TechCrunch All Stage 2025,B2B,None,None,0.0,Venture Capital,None,Interactive roundtables Dynamic breakouts,Startup scaling expertise community building,Need for insights on navigating complexities of scaling businesses,None,Founders and startups need help navigating the complexities of scaling their businesses,7.0,5.0
817a2c7429d220b82c923f2c4d2f5514,"TechCrunch Disrupt 2025: Final 24 hours to save up to $1,130",https://techcrunch.com/2025/02/28/techcrunch-disrupt-2025-final-hours-to-save-up-to-1130/,None,2025-02-28,Techcrunch,"TechCrunch Disrupt 2025 is offering savings up to $1,130 on passes for the event taking place in San Francisco on October 27-29, featuring tech leaders, sessions, and the Startup Battlefield 200 competition.","TechCrunch Disrupt, Startup Battlefield, Tech events",0.7,70.0,Positive,"Venture Capital, Entrepreneurship, Startups",None,"TechCrunch, Trello, Mint, Dropbox, Discord, Cloudflare","San Francisco, USA",None,"TechCrunch Disrupt 2025, Startup Battlefield 200",B2B,None,None,0.1,Venture Capital,None,Startup Battlefield competitionNetworking opportunities,Startup competitionsNetworking events,None,None,"Startups seek funding opportunities, networking, and exposure.",8.0,5.0
8a9a2c1c8c3d5b4a9e5d2f7a1b6c5e4d,Only 3 more days to save up to $325 at TechCrunch Sessions: AI,https://techcrunch.com/2025/02/28/only-3-more-days-to-save-up-to-325-at-techcrunch-sessions-ai/,None,2025-02-28,Techcrunch,"TechCrunch Sessions: AI is offering a discount of up to $325 on tickets until March 2nd and will take place on June 5 in Zellerbach Hall at UC Berkeley, featuring speakers from Khosla Ventures, Odyssey, CapitalG, and Twelve Labs. The event aims to explore AI from various perspectives, connecting startup founders, investors, and visionaries.","TechCrunch Sessions: AI, AI Innovation, AI investment",0.7,70.0,Positive,"Artificial Intelligence, Venture Capital, Events","Kanu Gulati, Oliver Cameron, Jill Chase, Jae Lee","Khosla Ventures, PolyAI, Regie, Waabi, Intel, Cadence, Odyssey, Voyage, CapitalG, Alphabet, Google, Magic, /dev/agents, Motif, Stanford University, Y Combinator, Twelve Labs, UC Berkeley","Berkeley, USA",None,TechCrunch Sessions: AI,None,None,"Khosla Ventures, CapitalG",0.325,Generative AI,None,"World models cinematic interactive worlds in real-time, AI-powered video intelligence","Generative AI, Multimodal foundation models, AI Investment","Staying relevant in the fast-paced AI market, analyzing and understanding massive video corpora",None,AI leaders and tech enthusiasts seek expert insights and networking opportunities,9.0,7.0
4b93426f08693972714ef77418c0e56a,2025 TechCrunch Events Calendar,https://techcrunch.com/2025/02/27/2025-techcrunch-events-calendar/,None,2025-02-27,Techcrunch,"TechCrunch announces its 2025 events calendar, featuring events like Disrupt, TC Sessions: AI, and StrictlyVC, aimed at connecting founders, investors, and innovators.","TechCrunch Disrupt, AI, Venture Capital",0.8,80.0,Positive,"Venture Capital, Artificial Intelligence, Entrepreneurship","Mark Zuckerberg, Anne Wojcicki, Whitney Wolfe Herd","TechCrunch, Fidelity Investments, Forerunner Ventures, Mayfield, Playground Global","San Francisco, USA",None,"TechCrunch Disrupt, TC Sessions: AI, StrictlyVC",B2B,"Pre-Seed, Series B","Sequoia Capital, a16z",0.0,Generative AI,"AI Events, Startup Ecosystem",AI pitch fine-tuning scaling infrastructure for millions,AI adoption startup ecosystem founder-focused events,need for authentic insights from top investors founders and operators,None,Founders need actionable insights on raising seed funding and managing international expansion,8.0,7.0
1a93b3851b2256d76660a198390d7a2c,Sequoia’s Roelof Botha warns ‘chumps’ not to buy into SPVs,https://techcrunch.com/2025/02/27/sequoias-roelof-botha-warns-chumps-not-to-buy-into-spvs/,None,2025-02-27,Techcrunch,"Roelof Botha of Sequoia warns against investing in Special Purpose Vehicles (SPVs) due to inflated prices and the risk of repeating past mistakes in the venture capital market, particularly within AI investments where SPVs are increasingly common.","SPV, Venture Capital, AI Investing",-0.4,40.0,Negative,"Venture Capital, Investment, Artificial Intelligence",Roelof Botha,"Sequoia Capital, Anthropic, Figure AI, Andreessen Horowitz",None,None,None,None,None,"Sequoia Capital, Andreessen Horowitz",3500.0,Fintech AI,Investment Platforms,Alternative investment vehiclesTransparency in SPV structures,Increased use of SPVs in AI investments,Transparency in SPV investmentsDue diligence resources for family offices,Sequoia's Roelof Botha warns against investment strategies potentially used by rival firms like Andreessen Horowitz.,"Family offices may lack sufficient due diligence capabilities when investing in SPVs, relying on the reputation of lead investors.",8.0,7.0
64bcfd4f6102a9092c622e3d678b0b6f,"ResilienceVC bucks trend, unveils $56M fund to back fintechs working on financial inclusion",https://techcrunch.com/2025/02/27/resiliencevc-bucks-trend-unveils-56m-fund-to-back-fintechs-working-on-financial-inclusion/,None,2025-02-27,Techcrunch,"ResilienceVC, a new seed-stage fintech venture capital firm, announced its $56 million debut fund to back fintech companies focused on financial inclusion for Americans. The firm aims to invest in startups leveraging new technologies to address challenges like homeownership, affordable insurance, and access to government benefits.","Financial Inclusion, Fintech, Venture Capital",0.7,80.0,Positive,"Venture Capital, Fintech, Financial Inclusion","Tahira Dosani, Vikas Raj","ResilienceVC, Accion Venture Lab, MetLife, Skoll Foundation, Ally Financial, Alice, Chaiz, EarlyBird, Foyer, Mirza, OS Benefits, PartnerSlate, Suma","Washington, D.C., USA",None,None,B2C,Seed,"MetLife, Skoll Foundation, Ally Financial",56.0,Fintech AI,Financial Inclusion Platforms,AI and embedded fintech for financial resilience,Financial Inclusion Embedded Fintech AI,Underserved mass market Financial services for low to moderate income High-net-worth focused fintech,"ResilienceVC focusing on the mass market, unlike fintech businesses focused on high-net-worth customers or large enterprises.","Demand for financial stability solutions for Americans, Need for fintech services for low to moderate income individuals and small businesses",9.0,7.0
6090877e7b9f0d569f04062a59532b8b,"TechCrunch Disrupt 2025: Just 2 days left to save up to $1,130",https://techcrunch.com/2025/02/27/techcrunch-disrupt-2025-just-2-days-left-to-save-up-to-1130/,None,2025-02-27,Techcrunch,"TechCrunch Disrupt 2025 is offering discounted tickets until February 28th, providing an opportunity to connect with tech leaders, attend sessions, and witness the Startup Battlefield competition. The event will take place October 27-29 in San Francisco.","TechCrunch Disrupt, Startup Battlefield, Innovation",0.7,70.0,Positive,"Venture Capital, Innovation, Entrepreneurship",None,"TechCrunch, Trello, Mint, Dropbox, Discord, Cloudflare","San Francisco, USA",None,"TechCrunch Disrupt 2025, Startup Battlefield 200",B2B,None,None,0.1,Generative AI,None,Startup Battlefield,Entrepreneurship Innovation,None,None,None,7.0,5.0
a16zhiresformerrepublicancongressmanpatrickmchenryasadvisor,a16z hires former Republican congressman Patrick McHenry as advisor,https://techcrunch.com/2025/02/26/a16z-hires-former-republican-congressman-patrick-mchenry-as-advisor/,None,2025-02-26,Techcrunch,"Andreessen Horowitz (a16z) has hired former Republican congressman Patrick McHenry as a senior advisor to advocate for startups with policymakers, furthering a16z's increasing involvement in policy and government.","Andreessen Horowitz, Patrick McHenry, Crypto",0.2,30.0,Positive,"Venture Capital, Government Tech, Crypto","Patrick McHenry, Gary Gensler, Brian Quintenz, Sriram Krishnan, Scott Kupor, Jamie Sullivan, Daniel Penny","Andreessen Horowitz, House Financial Services Committee, SEC, Coinbase, Robinhood, Commodity Futures Trading Commission, White House, Office of Personnel Management",None,None,None,B2B,None,None,7600.0,Fintech AI,RegTech,Advocating for startups with policymakers embedding VC into policy and government backing startups in defense and government tech,"Government regulation of crypto, Venture capital investment in government tech",None,SEC vs Crypto exchanges like Coinbase and Robinhood. a16z involvement in government related to crypto regulation,"Startups need policy advocacy, crypto companies face regulatory uncertainty.",8.0,6.0
